{
  "$schema": "https://json-schema.org/draft/2020-12/schema",
  "$id": "https://wemove.com/schemas/ingrid/schemes/publicationBase",
  "type": "object",
  "definitions": {
    "propertiesPublication": {
      "type": "object",
      "properties": {
        "isOpenData": {
          "type": ["null", "boolean"]
        }
      }
    }
  },
  "properties": {
    "properties": {
      "$ref": "#/definitions/propertiesPublication"
    },
    "_uuid": {
      "type": "string"
    },
    "_type": {
      "const": "InGridPublication"
    },
    "title": {
      "type": "string"
    },
    "description": {
      "type": "string"
    },
    "alternateTitle": {
      "type": ["null", "string"]
    },
    "serviceType": {
      "anyOf": [
        {
          "type": "object",
          "additionalProperties": false,
          "properties": {
            "key": {
              "type": "string"
            }
          }
        },
        {
          "type": "null"
        }
      ]
    },
    "serviceUrls": {
      "type": "array",
      "items": {
        "type": "object",
        "additionalProperties": false,
        "properties": {
          "url": {
            "type": "string"
          },
          "name": {
            "type": "string"
          },
          "description": {
            "type": "string"
          }
        }
      }
    },
    "serviceVersion": {
      "type": "array",
      "items": {
        "$ref": "../../general.schema.json#/definitions/KeyValue"
      }
    },
    "parentIdentifier": {
      "type": ["null", "string"]
    },
    "pointOfContact": {
      "type": "array",
      "items": {
        "$ref": "../../general.schema.json#/definitions/PointOfContact"
      },
      "minItems": 1
    },
    "publication": {
      "type": "object",
      "additionalProperties": false,
      "properties": {
        "isbn": {
          "type": ["null", "string"]
        },
        "pages": {
          "type": ["null", "string"]
        },
        "author": {
          "type": ["null", "string"]
        },
        "volume": {
          "type": ["null", "string"]
        },
        "location": {
          "type": ["null", "string"]
        },
        "publisher": {
          "type": ["null", "string"]
        },
        "explanation": {
          "type": ["null", "string"]
        },
        "publishedIn": {
          "type": ["null", "string"]
        },
        "baseDataText": {
          "type": ["null", "string"]
        },
        "doi": {
          "type": ["null", "string"]
        },
        "generalResourceType": {
          "anyOf": [
            {
              "$ref": "../../general.schema.json#/definitions/KeyValue"
            },
            {
              "type": "null"
            }
          ]
        },
        "resourceType": {
          "anyOf": [
            {
              "$ref": "../../general.schema.json#/definitions/KeyValue"
            },
            {
              "type": "null"
            }
          ]
        },
        "documentType": {
          "anyOf": [
            {
              "$ref": "../../general.schema.json#/definitions/KeyValue"
            },
            {
              "type": "null"
            }
          ]
        },
        "publicationDate": {
          "type": ["null", "string"]
        },
        "publishingHouse": {
          "type": ["null", "string"]
        },
        "bibliographicData": {
          "type": ["null", "string"]
        },
        "placeOfPublication": {
          "type": ["null", "string"]
        }
      }
    },
    "themes": {
      "$ref": "refs/general.schema.json#/definitions/themes"
    },
    "spatial": {
      "$ref": "refs/general.schema.json#/definitions/Spatial"
    },
    "temporal": {
      "$ref": "refs/general.schema.json#/definitions/temporal"
    },
    "dataset": {
      "$ref": "refs/general.schema.json#/definitions/dataset"
    },
    "extraInfo": {
      "$ref": "refs/general.schema.json#/definitions/extraInfo"
    },
    "metadata": {
      "$ref": "refs/general.schema.json#/definitions/metadata"
    },
    "resource": {
      "$ref": "refs/general.schema.json#/definitions/resource"
    },
    "keywords": {
      "$ref": "refs/general.schema.json#/definitions/keywords"
    },
    "maintenanceInformation": {
      "$ref": "refs/general.schema.json#/definitions/maintenanceInformation"
    },
    "references": {
      "$ref": "refs/general.schema.json#/definitions/references"
    },
    "graphicOverviews": {
      "$ref": "refs/general.schema.json#/definitions/graphicOverviews"
    },
    "digitalTransferOptions": {
      "$ref": "refs/general.schema.json#/definitions/digitalTransferOptions"
    },
    "categoryCatalog": {
      "$ref": "refs/general.schema.json#/definitions/categoryCatalog"
    },
    "databaseContent": {
      "$ref": "refs/general.schema.json#/definitions/databaseContent"
    },
    "explanation": {
      "$ref": "refs/general.schema.json#/definitions/explanation"
    },
    "methodText": {
      "$ref": "refs/general.schema.json#/definitions/methodText"
    },
    "orderInfo": {
      "$ref": "refs/general.schema.json#/definitions/orderInfo"
    },
    "distribution": {
      "$ref": "refs/general.schema.json#/definitions/distribution"
    },
    "openDataCategories": {
      "type": "array",
      "items": {
        "$ref": "../../general.schema.json#/definitions/KeyValue"
      }
    }
  },
  "required": [
    "_uuid",
    "_type",
    "title",
    "description",
    "pointOfContact",
    "spatial",
    "temporal",
    "metadata",
    "dataset"
  ],
  "title": "Publication"
}
